{
  "$schema": "https://json-schema.org/draft/2020-12/schema",
  "title": "XBearApplication",
  "description": "应用记录与操作记录的可观测契约。根对象描述某个应用包在某个实例中的当前可观测事实；$defs 中的 operation 描述一次操作的可观测结果，两者同文件是因为操作记录必然以包名为目标、且应用记录要靠最近一次操作来解释自身的安装状态。Windows 端与 Android 端共用。当前为规格先行：Windows 端尚无实现，本契约先固定两端必须一致产出的字段与取值。",
  "type": "object",
  "required": ["schemaVersion", "packageName", "instanceRef", "installState"],
  "additionalProperties": false,
  "properties": {
    "schemaVersion": {
      "type": "string",
      "pattern": "^\\d+\\.\\d+\\.\\d+$",
      "description": "应用记录契约自身的版本。与 spec/version.json 的 spec.version 同源，改动本契约的可解析内容时必须同步递增。"
    },
    "packageName": {
      "type": "string",
      "pattern": "^[a-z][a-z0-9_]*(\\.[a-z][a-z0-9_]*)+$",
      "minLength": 3,
      "maxLength": 255,
      "description": "应用在实例内的唯一标识，即 Android 包名，是跨实例稳定的自然主键：同一应用在多个实例中的 packageName 相同，其余字段各不相同。按 Android 生态惯例约束为至少两段、每段以小写字母开头、其后接小写字母数字与下划线、段间以点分隔。不允许出现大写字母或以数字开头的段。"
    },
    "instanceRef": {
      "type": "string",
      "pattern": "^[a-z0-9][a-z0-9-]{1,62}[a-z0-9]$",
      "description": "所属实例的标识，引用 instance.schema.json 中的 id，取值域与该契约的 id 完全一致。应用记录随实例一同失效，实例删除后该引用不再可解析。"
    },
    "installState": {
      "enum": ["installed", "notInstalled"],
      "description": "安装状态。installed = 该包已在本实例中注册，可解析到入口组件；notInstalled = 该包不存在于本实例，仅作为待安装清单条目存在。只有这两种可观测结果，卸载完成后回到 notInstalled，不保留中间态。"
    },
    "versionName": {
      "type": "string",
      "minLength": 1,
      "maxLength": 128,
      "description": "应用自报的版本名，形如 3.8.2 或 1.0.1-39-g27bb2491，是给人看的字符串，不保证可比较大小。仅在已安装时有值。"
    },
    "versionCode": {
      "type": "integer",
      "minimum": 1,
      "maximum": 2147483647,
      "description": "应用自报的版本号，正整数，是给系统看的单调递增整数。同一个包名下它才是升级成败的判据，版本名相同时以它区分。降级安装会被系统拒绝，参见 lastOperation 的失败码。仅在已安装时有值。"
    },
    "primaryCpuAbi": {
      "enum": ["x86_64", "x86", "arm64-v8a", "armeabi-v7a", "armeabi", "none"],
      "description": "实例实际承载该应用的 ABI，由包管理器在应用声明的 ABI 与实例的 ro.product.cpu.abilist 求交后选出，不是应用自述值也不是宿主 CPU 架构。x86_64 是 x86 宿主上的首选；arm64-v8a 表示该应用为纯 ARM 实现，经镜像集成的二进制转译层运行，本产品的 Bliss OS 镜像已实测可装可跑此类应用。none 表示纯 Java 应用，无原生库。此取值域锚定 Android 平台既定的 ABI 命名，新增取值按 spec/version.json 的规则属修改取值域，须递增主版本。"
    },
    "installedAt": {
      "type": "string",
      "format": "date-time",
      "pattern": "^\\d{4}-\\d{2}-\\d{2}T\\d{2}:\\d{2}:\\d{2}(\\.\\d+)?(Z|[+-]\\d{2}:\\d{2})$",
      "description": "本次安装在本实例内完成的时刻，必须带时区偏移。取自实例内系统时钟，与宿主时钟可能存在偏差，跨端比对时以本字段为准并容忍该偏差。升级重装会刷新该值；仅在已安装时有值。"
    },
    "launchActivity": {
      "type": "string",
      "pattern": "^(\\.[A-Za-z][A-Za-z0-9_$]*|[A-Za-z][A-Za-z0-9_]*(\\.[A-Za-z0-9_$]+)*)$",
      "maxLength": 255,
      "description": "可拉起的入口组件名，取自实例侧的解析结果。接受点号开头的简写形式（如 .MainActivity）与完整形式（如 com.example.handyplayer.MainActivity）。解析不到入口组件时缺省，不允许由两端自行猜测类名。"
    },
    "source": {
      "type": "object",
      "description": "安装来源。只记录应用包的内容身份，不记录宿主绝对路径：路径是宿主本地状态，跨机器不可移植也不应进入共享契约，宿主在自己的应用库内按内容身份解析位置。缺省表示该记录来自身份列举而非一次已知来源的安装，例如系统自带应用或直接列举包名得到的记录。",
      "additionalProperties": false,
      "required": ["fileName"],
      "properties": {
        "fileName": {
          "type": "string",
          "pattern": "^[A-Za-z0-9][A-Za-z0-9._+-]*\\.[aA][pP][kK]$",
          "minLength": 5,
          "maxLength": 255,
          "description": "安装所用的 APK 文件名，只取 basename。同一包名可以有多个历史文件名的记录，以 sha256 为准判别。"
        },
        "sha256": {
          "type": "string",
          "pattern": "^[0-9a-f]{64}$",
          "description": "APK 文件的 SHA-256，与 image.schema.json 的 source.sha256 同口径。用于校验来源与判别同名不同包。"
        },
        "sizeBytes": {
          "type": "integer",
          "minimum": 0,
          "description": "APK 文件字节数，与 image.schema.json 的 source.sizeBytes 同口径。"
        }
      }
    },
    "lastOperation": {
      "$ref": "#/$defs/operation",
      "description": "最近一次作用于该包的操作记录，用于解释 installState 与 installedAt 的由来。缺省表示本记录不是由一次已记录的操作产生的，例如首次全量列举时。"
    }
  },
  "allOf": [
    {
      "if": {
        "properties": { "installState": { "const": "notInstalled" } },
        "required": ["installState"]
      },
      "then": {
        "description": "未安装的包只有身份与状态可言，版本、ABI、安装时刻、入口组件与安装来源一律不得出现：给未安装的包标注版本号或 ABI 没有可观测来源，只会诱使两端各自编造。",
        "not": {
          "anyOf": [
            { "required": ["versionName"] },
            { "required": ["versionCode"] },
            { "required": ["primaryCpuAbi"] },
            { "required": ["installedAt"] },
            { "required": ["launchActivity"] },
            { "required": ["source"] }
          ]
        }
      }
    }
  ],
  "$defs": {
    "operation": {
      "title": "XBearApplicationOperation",
      "description": "一次应用操作的可观测结果记录。安装、卸载、拉起三类操作共用同一形状，差异只在 operation 与失败分类。与应用记录同文件同契约版本：操作记录以 packageName 为目标，脱离应用记录无法独立成立，而应用记录又需要最近一次操作来解释自身状态，拆成两个文件会形成双向引用并让两处 schemaVersion 各自递增。",
      "type": "object",
      "required": ["schemaVersion", "id", "instanceRef", "operation", "packageName", "result", "occurredAt"],
      "additionalProperties": false,
      "properties": {
        "schemaVersion": {
          "type": "string",
          "pattern": "^\\d+\\.\\d+\\.\\d+$",
          "description": "操作记录契约自身的版本，与应用记录独立递增，便于只调整操作语义而不牵动记录字段。"
        },
        "id": {
          "type": "string",
          "pattern": "^[a-z0-9][a-z0-9-]{1,62}[a-z0-9]$",
          "description": "操作的唯一标识，宿主侧发号，用于失败重试时关联同一次意图的多次尝试。"
        },
        "instanceRef": {
          "type": "string",
          "pattern": "^[a-z0-9][a-z0-9-]{1,62}[a-z0-9]$",
          "description": "操作发生的实例，引用 instance.schema.json 中的 id，取值域与该契约的 id 完全一致。实例未处于运行态时操作不应发生，记录不得凭空出现。"
        },
        "operation": {
          "enum": ["install", "uninstall", "launch"],
          "description": "操作类型。install = 把 APK 装入实例；uninstall = 从实例移除该包；launch = 拉起该包的入口组件。刻意不用「启动」一词：术语表中启动已固定指实例从停止态转为运行态，用同一个词描述拉起应用会让两端在同一句话里指两件事。Windows 端后续若扩展清数据、重启应用等操作，在此基础上追加取值。"
        },
        "packageName": {
          "type": "string",
          "pattern": "^[a-z][a-z0-9_]*(\\.[a-z][a-z0-9_]*)+$",
          "minLength": 3,
          "maxLength": 255,
          "description": "操作目标的包名，约束与本契约根对象的 packageName 完全一致。必须是操作发起时就能确定的包名，不允许用模糊匹配到的多个候选代替。"
        },
        "result": {
          "enum": ["success", "failure"],
          "description": "操作结果。只有这两种可观测结论，不设中间态：工具层面未确认成功即判失败，由调用方按需重试。"
        },
        "occurredAt": {
          "type": "string",
          "format": "date-time",
          "pattern": "^\\d{4}-\\d{2}-\\d{2}T\\d{2}:\\d{2}:\\d{2}(\\.\\d+)?(Z|[+-]\\d{2}:\\d{2})$",
          "description": "操作完成的时刻，必须带时区偏移。取实例侧完成回报的时刻而非发起时刻，失败时同样有意义。刻意不用 createdAt：本记录描述的是一次发生的事件，不是被创建出来的物件。"
        },
        "durationMs": {
          "type": "integer",
          "minimum": 0,
          "description": "端到端耗时毫秒数。安装与卸载为宿主发起到实例回报完成的墙钟耗时；拉起为工具口径首帧完成耗时，与 spec/baseline.json 中 app-cold-start 的测量口径一致，可直接回填基线指标。"
        },
        "failureReason": {
          "type": "object",
          "description": "失败归因。仅在 result = failure 时出现，成功时不得出现。",
          "additionalProperties": false,
          "required": ["category", "code"],
          "properties": {
            "category": {
              "enum": ["user", "guest", "environment", "provider"],
              "description": "失败归类，取值沿用 spec/terminology.json 中四类错误的术语 id：user 对应配置错误（配置本身非法，立即返回，不进入任何中间态）；guest 对应实例内错误（实例内出现问题，可重试）；environment 对应宿主环境错误（宿主不满足前提，需给出修复指引）；provider 对应虚拟化实现错误（实现内部失败，记录日志，允许重试）。归类决定两端如何处置，不能各自另定一套。"
            },
            "code": {
              "type": "string",
              "pattern": "^[A-Z][A-Z0-9_]*$",
              "minLength": 2,
              "maxLength": 64,
              "description": "工具层面的原始失败码，取自实例侧回报，不翻译、不归并、不截断，例如 INSTALL_FAILED_OLDER_SDK（应用要求的 SDK 高于实例）、INSTALL_FAILED_NO_MATCHING_ABIS（无匹配 ABI）、INSTALL_FAILED_VERSION_DOWNGRADE（版本号低于已装版本）、INSTALL_FAILED_UPDATE_INCOMPATIBLE（签名与已装版本不一致）。刻意不做闭合枚举：取值由实例内的包管理器决定，本产品未穷举的码必须原样留存，丢失即等于掩盖了失败真相。宿主侧自身产生的失败沿用同一形状，取 HOST_ 前缀。"
            },
            "message": {
              "type": "string",
              "maxLength": 512,
              "description": "工具回报的关键输出片段，原样保留，供界面展示与排查。不得写入密钥、路径等与排障无关的内容。"
            }
          }
        }
      },
      "allOf": [
        {
          "if": {
            "properties": { "result": { "const": "failure" } },
            "required": ["result"]
          },
          "then": {
            "description": "判为失败必须给出归因，否则调用方无法区分该重试、该改配置还是该报障。",
            "required": ["failureReason"]
          }
        },
        {
          "if": {
            "properties": { "result": { "const": "success" } },
            "required": ["result"]
          },
          "then": {
            "description": "成功的操作没有失败归因，带上即为两端判定不一致。",
            "not": { "required": ["failureReason"] }
          }
        }
      ]
    }
  }
}
